Date,Season,Year,Type,Country,Source,Age,Sex,State,Location,Fatal Y/N,Activity,Species
18-Mar,Spring,2026,Unprovoked,usa,us sun: mendocino coast news:melissa michaelson:,39,M,California,Big River Beach Mendocino County,N,surfing,white shark
14-Mar,,2026,Unprovoked,australia,people magazine: kevin mcmurray trackingsharks.com,Unknown,F,Western Australia,Exmouth,N,swimming,other
10-Mar,,2026,Unprovoked,australia,perth now: kevin mcmurray trackingsharks.com,Unknown,M,Western Australia,Exmouth,N,other,white shark
05-Mar,,2026,Unprovoked,australia,news.com.au: abc news: andy currie,Unknown,M,Queensland,Lady Elliott Island,N,snorkeling,other
22-Feb,,2026,Unprovoked,new caledonia,johannes marchand: andy currie,55,M,Noumea,Anse Vata near Point Magnin,Y,other,tiger shark
06-Feb,,2026,Unprovoked,cayman islands,kevin mcmurray trackingshark.som,Unknown,M,Unknown,Caribbean Sea,N,diving,tiger shark
29-Jan,,2026,Unprovoked,brazil,kevin mcmurray trackingsharks.com: tv globo: people: surfer magazine,13,M,Recife,Del Chifre Beach in Olinda,Y,swimming,tiger shark
29-Jan,,2026,Unprovoked,australia,bob myatt gsaf,Unknown,M,Nsw,Angels Beach East Ballina,N,surfing,other
24-Jan,,2026,Unprovoked,australia,bob myatt gsaf,Unknown,F,Tasmania,Cooee Beach west of Burnie,N,swimming,other
20-Jan,,2026,Unprovoked,australia,bob myatt gsaf,39,M,Nsw,Point Plomber North of Port Macquarie,N,surfing,bull shark
19-Jan,,2026,Unprovoked,australia,andy currie,11,M,Nsw,Dee Why,N,surfing,bull shark
19-Jan,,2026,Unprovoked,australia,9 news: bob myatt gsaf,27,M,Nsw,North Steyne ,N,surfing,other
18-Jan,,2026,Unprovoked,australia,bob myatt gsaf,12,M,Nsw,Nielsen Park Vaucluse Sydney Harbour,Y,other,bull shark
13-Jan,Winter,2026,Unprovoked,usa,bob myatt gsaf,26,M,California,Mendocino County ,N,surfing,other
10-Jan,,2026,Unprovoked,australia,bob myatt gsaf,Unknown,M,Nsw,Avalon Beach,N,surfing,other
08-Jan,,2026,Unprovoked,us virgin islands,todd smith: kevinmcmurray trackingsharks.com,56,F,Unknown,Dorsch Beach,Y,snorkeling,other
05-Jan,,2026,Unprovoked,mozambique,kevin mcmurray trackingsharks.com : macao news:,Unknown,M,Inhambe Province,Vilanculous District,Y,diving,other
03-Jan,,2026,Provoked,new caledonia,andy currie: province sud:,Unknown,M,Kélé,Between Bourail and Moindou,N,other,other
25-Dec,,2025,Unprovoked,mozambique,kevin mcmurray trackingsharks.com,Unknown,Unknown,Inhambe Province,Prainha,Y,other,other
21-Dec,,2025,Unprovoked,australia,7 news: facebook: bob myatt gsaf,Unknown,M,Western Australia,Ocean Reef North Perth,N,other,white shark
21-Dec,Winter,2025,Unprovoked,usa,kevin mcmurray tracking sharks.com: ralph collier gsaf: james kingsley: sfgate:,55,F,California,Lovers Point Pacific Grove,Y,swimming,white shark
12-Dec,Winter,2025,Unprovoked,usa,kevin mcmurray tracking sharks.com:andrew currie: facebook sonoma sheriff's office:,Unknown,M,Sonoma County California,Salmon Creek,N,surfing,white shark
09-Dec,Winter,2025,Provoked,usa,hawaii news now:diver.net,24,M,Unknown,"Ka'alu""alu Beach",N,other,reef shark
27-Nov,,2025,Unprovoked,australia,media: todd smith: andy currie: simon de marchi: kevin mcmurray tracking sharks.com,26,M,Nsw,Crowdy Bay,N,swimming,bull shark
27-Nov,,2025,Unprovoked,australia,media: todd smith: andy currie: simon de marchi: kevin mcmurray tracking sharks.com,25,F,Nsw,Crowdy Bay,Y,swimming,bull shark
10-Nov,,2025,Unprovoked,australia,andy currie,61,M,Western Australia,Prevelly Beach Magaret River,N,other,white shark
09-Nov,,2025,Unprovoked,french polynesia,andrew currie,40,M,Unknown,Hakahau Bay,N,swimming,other
05-Nov,Fall,2025,Unprovoked,usa,james kingsley: andy currie: beat of hawaii:,Unknown,M,Hawaii,Pine Trees Hanalei Bay Kaui,N,swimming,other
05-Nov,Fall,2025,Unprovoked,usa,christofer eskander: the bay city tribune:,Unknown,M,Texas,Matagorda Beach Matagorda,N,fishing,other
04-Nov,,2025,Unprovoked,samoa,andy currie: stab magazine: facebook samoa observers post:,13,M,Unknown,Aga Reef Resort Lalomanu,N,surfing,tiger shark
14-Oct,,2025,Unprovoked,columbia,kevin mcmurray trackingsharks.com andy currie,14,M,"Bolivar, Del Isolate",Catagena Province,N,swimming,other
11-Oct,,2025,Unprovoked,australia,kevin mcmurray trackingsharks.com,14,M,Queensland,Cook Esplanade Thursday Island,N,swimming,tiger shark
07-Oct,,2025,Unprovoked,australia,kevin mcmurray trackingsharks.com,Unknown,M,South Australia,Kangaroo Island,N,surfing,whaler shark
29-Sep,Fall,2025,Unprovoked,usa,todd smith: kevin mcmurray trackingsharks.com,54,M,Unknown,Catalina Island,N,swimming,other
27-Sep,,2025,Provoked,costa rica,todd smith: kevin mcmurray trackingsharks.com,48,M,Unknown,Cocos Islands,N,other,tiger shark
06-Sep,,2025,Unprovoked,australia,todd smith: andy currie: simon de marchi: kevin mcmurray trackingsharks.com:,57,M,Nsw,Long Reef Sydney,Y,surfing,white shark
16-Sep,Fall,2012,Unprovoked,usa,"florida today, 9/16/2012",52,M,Florida," Cocoa Beach, Brevard  County",N,surfing,other
30-Aug,Summer,2025,Unprovoked,usa,bob myatt gsaf : people:,8,F,Texas,Galveston,N,swimming,other
18-Aug,,2025,Unprovoked,australia,bob myatt gsaf the guardian: 9 news: abs news: daily telegraph:,Unknown,M,Nsw,Cabarita Beach,N,surfing,white shark
17-Aug,,2025,Unprovoked,bahamas,ralph collier gsaf and kevin mcmurray trackingsharks.com,63,M,Unknown,North of Grand Bahama near Freeport,N,fishing,other
16-Aug,Summer,2025,Provoked,usa,johannes marchand: kevin mcmurray trackingsharks.com,Unknown,M,Florida,Cayo Costa Boca Grande,N,fishing,other
07-Aug,,2025,Unprovoked,australia,bob myatt gsaf,9,M,Nsw,Tathra Beach ,N,surfing,white shark
01-Aug,,2025,Unprovoked,puerto rico,kevin mcmurray trackingsharks.com: ny post,39,F,Carolina,Carolina Beach,N,wading,other
28-Jul,,2025,Unprovoked,australia,bob myatt gsaf: simon de marchi:,19,M,South Australia,Seacliff beach Adelaide,N,kayaking,white shark
25-Jul,,2025,Unprovoked,french polynesia,brandyn gartelman:kevin mcmurray trackingsharks.com,7,M,Nuku Hiva,Taiohae Bay,N,swimming,other
22-Jul,,2025,Unprovoked,spain,bob myatt gsaf,85,F,Majorca,Playa de Palma beach,N,swimming,other
20-Jul,,2025,Unprovoked,canary islands,kevin mcmurray trackingsharks.com,Unknown,M,Fuerteventura,Los Mollinas,N,surfing,other
19-Jul,Summer,2025,Unprovoked,usa,brandyn gartelman: kevin mcmurray trackingsharks.com nbc 6:,69,M,Florida,Jupiter Inlet off Jupiter Beach Palm Beach County,N,diving,other
18-Jul,Summer,2025,Unprovoked,usa,brandyn gartelman: kevin mcmurray trackingsharks.com; fox 35,18,M,Florida,New Smyrna Beach,N,surfing,other
15-Jul,,2025,Unprovoked,bahamas,kevin mcmurray trackingsharks.com: the palm beach post,66,M,Unknown,Spanish Cay,N,fishing,bull shark
06-Jul,Summer,2025,Provoked,usa,johannes marchand: nantucket current,21,M,Massachusetts,Hoicks Hollow Nantucket Beach,N,fishing,other
06-Jul,Summer,2025,Unprovoked,usa,todd smith:kevin mcmurray trackingsharks.com: fox 35:,40,M,Florida,New Smyrna Beach,N,surfing,other
04-Jul,,2025,Unprovoked,south africa,kevin mcmurray tracking sharks.com: east coast radio,37,M,Kwazulu-Natal,Mfazazana Hibberdene,Y,fishing,other
29-Jun,,2025,Unprovoked,australia,simon de marchi: kevin mcmurray trackingsharks.com: 9 news: daily mail:,16,M,Nsw,Norries Headland Cabarita Beach,N,swimming,bull shark
25-Jun,Summer,2025,Unprovoked,usa,scott curatolo-wagemann: news 12 long island: cnn:,20,F,Unknown,Wantagh,N,swimming,tiger shark
22-Jun,Summer,2025,Unprovoked,usa,todd smith: wjcl22 news: the island packet: kvnu:,Unknown,F,South Carolina,Coligny Beach Hilton Head Island  ,N,swimming,other
17-Jun,Summer,2025,Unprovoked,usa,kevin mcmurray trackingsharks.com:,12,F,South Carolina,Beach Marker 24 Hilton Head Island  ,N,swimming,other
11-Jun,Summer,2025,Unprovoked,usa,kevin mcmurray trackingsharks.com: james kingsley: fox 4 news,9,F,Florida,Boca Grande,N,snorkeling,bull shark
31-May,Spring,2025,Unprovoked,usa,james kingsley: the us sun,42,M,California,Montara State Beach,N,surfing,white shark
29-May,Spring,2025,Unprovoked,usa,kevin mcmurray trackingsharks.com: clay crewell:scott curatolo-wageman,26,M,North Carolina,Sunset Beach,N,swimming,other
26-May,,2025,Unprovoked,vanuatu,kevin mcmurray trackingsharks.com,14,M,South Santo,Espiitu Santo Island,Y,swimming,other
15-May,,2025,Unprovoked,australia,simon demarchi: todd smith: 9 news:abc news,66,M,South Australia,Port Noarlunga,N,swimming,other
08-May,,2025,Unprovoked,jamaica,the sun news: metro: kevin mcmurray tracking sharks.com,26,F,Unknown,Rose Hall beach,N,other,other
21-Apr,,2025,Unprovoked,israel,ynetnews.com: dailymirroe.co.uk: todd smith alessandro maddalena: andrew currie,45,M,Hadera,Olga Beach near Hadera Stream ,Y,diving,other
20-Apr,,2025,Unconfirmed,mexico,"mundo now: reutir"" kevin mcmurray trackingsharks.com",20,M,Quntana Roo,Chac Mool Beach Cancun,Y,other,other
19-Apr,,2025,Unprovoked,maldives,todd smith: the edition: https://en.sun.mv/96031,30,M,Kulhudhuffushi City,Haa Dhaalu atoll,N,snorkeling,other
12-Apr,Spring,2025,Unprovoked,usa,kevin mcmurray trackingsharks.com: florida news: www.dailymail.co.uk,Unknown,M,Florida,Everglades National Park Flamingo Lodge Highway West Miami-Dade (Monroe County),N,other,other
26-Mar,,2025,Unprovoked,australia,kevin mcmurray trackingsharks.com: www.surfer.com,Unknown,M,Wa,Sandtrax Port Beach North Fremantle Perth,N,swimming,tiger shark
10-Mar,,2025,Unprovoked,australia,bob myatt,37,M,Wa,Duke of Orleans Bay,Y,surfing,white shark
07-Mar,,2025,Unprovoked,australia,bob myatt,56,F,Nsw,Gunyah beach Bundeena Port Hacking,N,swimming,bull shark
27-Feb,,2025,Unprovoked,australia,kevin mcmurray trackingsharks.com,Unknown,M,Victoria,Nuns Beach near Portland,N,swimming,other
27-Feb,,2025,Unconfirmed,philippines,stephen parkhill   glen folkard,29,M,Batangas Resort,Verde Island,Y,other,other
22-Feb,,2025,Unprovoked,australia,bob myatt gsaf,35,F,Western Australia,Blasck Wall Reach Swan River Perth,N,kayaking,other
22-Feb,,2025,Unconfirmed,australia,simon de marchi: bob myatt gsaf,58,M,Nsw,Off Port Stephens near Newcastle,Y,fishing,mako shark
22-Feb,,2025,Unprovoked,australia,bob myatt gsaf,29,M,Queensland,The Wrecks walking track Moreton Island,N,snorkeling,other
10-Feb,,2025,Unprovoked,bahamas,dail mail australia todd smith: kevin mcmurray trackingsharks.com,24,F,Unknown,Bimini Bay,N,swimming,bull shark
10-Feb,,2025,Unprovoked,bahamas,dail mail australia todd smith: kevin mcmurray trackingsharks.com,20,F,Unknown,Bimini Bay,N,swimming,bull shark
07-Feb,,2025,Unprovoked,turks and caicos,todd smith: platform x kevin mcmurray  trackingsharks.com,55,F,Near Five Cays Settlement West Caicos,Thompson Cove Beach,N,swimming,bull shark
03-Feb,,2025,Unprovoked,australia,9 news: the brisbane times: the guardian,17,F,Queensland,"Woorim Beach, Bribie Island,",Y,swimming,bull shark
23-Jan,,2025,Unprovoked,australia,bob myatt gsaf,12,M,Western Australia,Shipwreck Cove,N,other,other
22-Jan,,2025,Unprovoked,australia,bob myatt gsaf,37,M,Western Australia,Cheynes beach ,N,surfing,whaler shark
03-Jan,,2025,Unprovoked,mozambique,kevin mcmurray trackingsharks.com,36,M,Inhambane Province,Vilankulo Bay,Y,fishing,other
11-Jan,Winter,2025,Provoked,usa,kevin mcmurray trackingsharks.com,23,M,Hawaii,Off Haleiwa Boat Harbour Oahu,N,diving,other
02-Jan,,2025,Unprovoked,new caledonia,johannes marchand todd smith,40,M,Grande Terre,Islet of Kendek near Koumac,Y,fishing,tiger shark
02-Jan,,2025,Unprovoked,australia,glen folkard: simon de marchi news.com.au: the news daily: the national tribune:,28,M,South Australia,Granites Beach near Westall Streaky Bay,Y,surfing,white shark
30-Dec,,2024,Unprovoked,mozambique,kevin mcmurray trackingsharks.com,Unknown,M,Unknown,?,Y,diving,other
29-Dec,,2024,Unprovoked,egypt,todd smith : kevin mcmurray trackingsharks .com: christofer eskander: simon de marchi: glen folkard,69,M,North Of Marsa Alam,Red Sea,N,other,tiger shark
29-Dec,,2024,Unprovoked,egypt,todd smith : kevin mcmurray trackingsharks .com: christofer eskander: simon de marchi: glen folkard,48,M,North Of Marsa Alam,Red Sea,Y,other,tiger shark
28-Dec,,2024,Unprovoked,australia,todd smith glen folkard abc news: the north west star: 9.com.au:,40,M,Queensland,Humpy Island Great Keppel Island,Y,fishing,other
02-Dec,,2024,Unprovoked,australia,glen folkard gsaf,Unknown,M,Queensland,Curtis Island Near Gladstone QLD central coast,N,fishing,other
01-Dec,,2024,Unprovoked,australia,bob myatt gsaf,Unknown,M,Western Australia,Greenough River Mouth Beach Cape Burney 12km south of Geraldton,N,surfing,other
30-Nov,,2024,Unprovoked,thailand,kevin mcmurray tracking sharks.com,57,F,Phang Nga Province,Khao Lak Beach,N,swimming,other
19-Nov,,2024,Unprovoked,new zealand,glen folkhard: todd smith: andy currie kevin mcmurray tracking sharks.com,24,M,Unknown,Chatham Islands,Y,diving,white shark
15-Nov,,2024,Unprovoked,maldives,the edition: kevin mcmurray tracking sharks.com: andy currie,45,F,Kaafu,Maafushi,N,diving,other
01-Nov,,2024,Unprovoked,hawaii,glen folkard: independent: fox news: sky news hawaii news hour:,61,M,Maui,Sand Piles Waiehu Beach Park,N,surfing,other
31-Oct,,2024,Unprovoked,australia,simon de marchi: 9 news: 7 news: abc news:,57,F,Queensland,Whitsunday Islands,N,snorkeling,tiger shark
21-Oct,Fall,1984,Unprovoked,usa,"miami herald, 10/24/1984, p.17a",23,F,Florida,"3 miles south of Sebastian Inlet State Park, Indian River County",N,surfing,other
14-Oct,,2024,Unprovoked,honduras,georgienne bradley: daily mail uk: ftn news.com,38,M,Tela,Atlantida,N,swimming,bull shark
12-Nov,Fall,1963,Provoked,usa,d.r. nelson,Unknown,M,Florida,"8 miles south of Elliot Key, Miami-Dade County",N,other,other
26-Sep,,2024,Unconfirmed,indonesia,new york post: espn: bob myatt gsaf,68,F,Timor Leste,Pulau Reong Island,Y,other,tiger shark
17-Sep,,2024,Unprovoked,honduras,daily mail uk: the sun uk:  the world watch,33,M,Trujillo Colon,Puerto Castillo,N,fishing,bull shark
16-Sep,,2024,Unprovoked,morocco,andy currie: moroccan world news: sky news,30,F,Southern Morocco,West of Dakhla,Y,swimming,white shark
26-Aug,,2024,Unprovoked,jamaica,todd smith: daily mail uk: sky news: people .com,16,M,Unknown,Falmouth,Y,fishing,tiger shark
06-Aug,,2024,Unprovoked,belize,kevin mcmurray tracking sharks.com new york post: abc news: the independent:,15,F,Unknown,Central America,N,swimming,reef shark
23-Jul,,2024,Unprovoked,australia,nine.com.au: abc.net.au johannes marchand,23,M,Nsw,"North Shore Beach, Port Macquarie",N,surfing,white shark
18-Jul,,2024,Unprovoked,australia,daily mail: sky news: the west australian,41,M,Western Australia,Trigg beach Sterling,N,surfing,other
08-Jul,Summer,2024,Unprovoked,usa,miami herald,14,M,Florida,Ponce de Leon Inlet Volusia County,N,other,other
08-Jul,,2024,Unprovoked,australia,bob myatt: simon demarchi: abc news,43,M,Western Australia,14 Mile Beach Coral Bay (Gascoyne Region),N,fishing,other
05-Jul,Summer,2024,Unprovoked,usa,sacbee fox 35,26,M,Florida,New Smyrna Beach,N,wading,other
04-Jul,Summer,2024,Unprovoked,usa,nbcdfw,45,F,Texas,South Padre Island,N,swimming,bull shark
04-Jul,Summer,2026,Unprovoked,usa,valley central,18,F,Texas,South Padre Island,N,swimming,other
04-Jul,Summer,2025,Unprovoked,usa,cnn,18,F,Texas,South Padre Island,N,swimming,other
04-Jul,Summer,2024,Unprovoked,usa,click orlando news journal on line,21,M,Florida,New Smyrna Beach,N,other,other
04-Jul,Summer,2024,Unprovoked,usa,brietbart .com,Unknown,M,Florida,New Smyrna Beach Beach Access 14 Volusia County,N,swimming,other
23-Jun,Summer,2024,Unprovoked,usa,cbc news:  sky news: bbc news,49,M,Hawaii,Goat Island (Moku'auia) La'ie Bay,Unknown,surfing,other
07-Jun,Summer,2024,Unprovoked,usa,newsweek.com: spectrunnews: hawaiinewsnow:,25,F,Hawaii,"Haleiwa, Oahu",N,swimming,tiger shark
07-Jun,Summer,2024,Unprovoked,usa,nwfdailynews:wdhn.com,15,F,Florida,Rosemary Beach Walton County,N,wading,bull shark
07-Jun,Summer,2024,Unprovoked,usa,nwfdailynews:wdhn.com,45,F,Florida,Water Sound  Beach Walton County,N,swimming,bull shark
02-Jun,Summer,2024,Unprovoked,usa,abc news san diego: del mar times:,46,M,California,Del Mar Beach San Diego,N,swimming,other
02-Jun,,2024,Unprovoked,maldive islands,www.raajjee.mv: www.edition.mv: www.avas.mv:,23,M,Maahvah Laamu Atoll,Indian Ocean,Y,other,other
28-May,Spring,2024,Unprovoked,usa,abc news: fox 26 houston:,19,F,Galveston,Jamaica Beach,N,wading,other
24-May,,2024,Unprovoked,turks and caicos,cbc news: ctv news atlantic: national post:,27,M,Unknown,Leward reef,N,snorkeling,other
23-May,,2024,Unprovoked,french polynesia,ladbible,20,M,Unknown,Mangareva Atoll,N,other,other
02-May,Spring,2024,Unprovoked,usa,post and courier: fox news: five live news:,65,M,South Carolina,Y-73' Ledge reef Chareston Coast,N,fishing,other
26-Apr,,2024,Unprovoked,tobago,sky news: the guardian:,64,M,Unknown,Turtle beach,N,swimming,bull shark
26-Apr,,2024,Unprovoked,bahamas,usa today: the independent: abc news,24,M,Clarence Town Long Isand,Flying Fish Marina,N,boating,reef shark
20-Apr,,2024,Unprovoked,australia,abc news australia: sky news:,16,M,South Australia,West beach Glenelg,N,fishing,white shark
20-Apr,,2024,Unprovoked,australia,abc news: w.a. today: the west australian: 7 news:,26,M,Western Australia,Lighthouse bombie surf spot Exemouth,N,surfing,other
08-Apr,,2024,Unprovoked,maldive islands,"unn.ua news, kyiv",Unknown,M,Nunu Atoll,Unspecified,N,swimming,other
15-Mar,,2024,Unprovoked,australia,"yahoo news, 3/15/2024",13,F,Queensland,Bargara Beach,N,swimming,tiger shark
04-Mar,Spring,2024,Unprovoked,usa,"surfer, 3/6/2024f",Unknown,M,Hawaii,"Old Man's, Waikiki",N,surfing,tiger shark
02-Mar,Spring,2024,Unprovoked,usa,"hawaii news now, 3/4/2024",11,F,Hawaii,"Rainbows, Oahu",N,swimming,other
25-Feb,,2024,Unprovoked,australia,"wa today, 2/26/2024",46,F,Western Australia,"Sandlnd Island, Jurian Bay",N,swimming,tiger shark
14-Feb,,2024,Unprovoked,india,"times of india, 2/14/2024",32,M,Maharashtra,"Vaitarna River, Palghar District",N,fishing,bull shark
04-Feb,,2024,Provoked,trinidad,"trinidad guardian, 2/11/2014",Unknown,M,Unknown,,N,fishing,reef shark
29-Jan,,2024,Unprovoked,australia,"nine news, 12/31/2024",29,F,New  South Wales,"Elizabeth Bay, Sydney Harbor",N,swimming,bull shark
15-Jan,,2024,Unprovoked,bahamas,"caribbean loop news, 1/15;2024",10,M,Unknown,Paradise Island Resort,N,swimming,other
09-Jan,,2024,Unprovoked,australia,"a. currie, gsaf",64,M,South Australia,"Walkers Beach, Elliston",N,surfing,white shark
05-Jan,,2024,Provoked,south africa,jacaranda fm. 12/6/2024,62,M,Eastern Cape Province,Papiesfontein,N,fishing,other
30-Dec,Winter,2023,Unprovoked,usa,"surfer, 12/31/2023",39,M,Hawaii,"Baby Beach, Maui",Y,surfing,other
29-Dec,,2023,Unprovoked,mexico,"euroeseuro, 12/31/2023",22,M,Sonora,"Tojahui Beach, Yavaros, Huatabampo",Y,other,white shark
28-Dec,,2023,Unprovoked,australia,"s. demarchi, gsaf",15,M,South Australia,Ethel Beach,Y,surfing,white shark
25-Dec,,2023,Unprovoked,australia,"9 news, 12/26/2023",16,M,New South Wales,Old Bar,N,surfing,other
24-Dec,,2023,Unprovoked,australia,"9 news, 12/25/2023",46,M,Western Australia,Wedge Island,N,other,whaler shark
18-Dec,,2023,Unprovoked,new zealand,"nz herald,  12/18/2023",21,F,Unknown,Riverton,N,wading,other
14-Dec,,2023,Unconfirmed,mexico,"el pais, 12/15/2023",66,M,Guerrero,"Playa Quieta, Ixtapa, Zihuatanejo",Y,swimming,other
14-Dec,,2023,Unconfirmed,mexico,"el pais, 12/15/2023",52,F,Guerrero,"Playa Quieta, Ixtapa, Zihuatanejo",N,swimming,other
08-Dec,,2023,Unprovoked,australia,"b. myatt, gsaf",20,M,Queensland,1770,N,snorkeling,other
04-Dec,,2023,Unprovoked,bahamas,"nbc news, 12/4/2023",44,F,New Providence   Isoad,Sandals Resort,Y,paddle,other
02-Dec,,2023,Unprovoked,mexico,"news channel 21, 12/3.2023",26,F,Jalisco,San Patricio Melaque,Y,swimming,other
30-Nov,,2023,Unprovoked,australia,"abc net, 11/30/2023",21,M,Queensland,Clack Island,N,swimming,bull shark
21-Nov,,2023,Unprovoked,bahamas,"eye witness news, 11/22/2023",47,F,Unknown,Tiger Beach,Y,other,other
10-Nov,,2023,Unprovoked,australia,s. demarchi. gsaf,32,F,South Australia,Port Noarlunga,N,other,other
15-Sep,Fall,2001,Unprovoked,usa,"g. hock, m. levine, gsaf; orlando sentinel, 9/18/2001, p.d2",Unknown,M,Florida,A quarter mile north of Fort Pierce Inlet,N,other,other
03-Nov,,2023,Unprovoked,australia,"daily mail, 11/3/2023",Unknown,M,Westerm Australia,Peak Island,N,fishing,other
02-Nov,,2023,Unprovoked,new zealand,"nz herald, 11/2/2023",Unknown,M,Unknown,Cape Pallister,N,other,white shark
Unknown,Unknown,2023,Unconfirmed,egypt,"daily mail, 11/2/2023",66,M,Unknown,Fury Shoal,N,other,white shark
31-Oct,,2023,Unprovoked,australia,s. demarchi. gsaf,55,M,South Australia,Streaky Bay,Y,surfing,white shark
25-Oct,Fall,2023,Unprovoked,usa,"surfer, 10/25/2023",30,M,Hawaii,"Pua ena Point,  Haleiwa, Oahu",N,surfing,tiger shark
23-Oct,,2023,Provoked,mexico,tyt newsroom. 10/26/2023,59,M,Quintana Roo,Banco Chinchorro Biosphere Reserve,N,fishing,other
21-Oct,,2023,Watercraft,australia,abc. 10/22/2023,Unknown,M,Western Australia,"Alexander Bay, Esperance",N,fishing,whaler shark
20-Oct,,2023,Unprovoked,belize,c. dinkel,8,F,Belize District,"San Pedro , Ambergris Caye",N,snorkeling,other
15-Oct,Fall,2023,Unprovoked,usa,"kaua'i now, 10/15/2023",50,M,Hawaii,"Hanalei Bay, Kauai",N,surfing,tiger shark
13-Oct,Fall,2023,Unprovoked,usa,"r. collier, gsaf",52,M,California,"Linda Mar, Pacific State Beach, San Mateo County",N,surfing,other
02-Oct,Fall,2023,Unprovoked,usa,"the beat of hawaii, 10/2/2023",45,F,Hawaii,"Paia, Maui",N,surfing,other
01-Oct,,2023,Unprovoked,australia,"b. myatt, gsaf",64,F,South Australia,Beachport,N,swimming,other
01-Oct,Fall,2023,Unprovoked,usa,"sf chronicle, 10/10/2023",52,M,California,"Wildcat Beach, Marin County",Y,swimming,other
18-Sep,Fall,2023,Unprovoked,usa,"c. creswell, gsaf",Unknown,M,South Carolina,"Myrtle Beach, Horry County",N,swimming,other
13-Sep,,2023,Unprovoked,egypt,m. maaty,34,F,South Sinai,Dahab,N,swimming,tiger shark
05-Oct,Fall,1958,Unprovoked,usa,r.f. hutton citing miami herald newspaper library,60,M,Florida,"Baker's Haulover, Miami Beach",N,other,other
25-Oct,Fall,2024,Unprovoked,usa,bob myatt: yardbarker: 12 on your side: wptv: the inertia:,27,M,Florida,"Bathtub Beach, Martin County",N,surfing,tiger shark
09-Sep,,2023,Unprovoked,philippines,"manila bulletin, 9 /10/2023",Unknown,M,Bolinao,"Pangasinan, Ilocos Norte, Luzon Island",Unknown,fishing,other
Unknown,Unknown,2023,Watercraft,coral sea,"b. myatt, gsaf",Unknown,M,Unknown,,N,other,other
02-Sep,Fall,1996,Unprovoked,usa,"s. petersohn, gsaf; orlando sentinel , 9//7/1996; daytona beach news journal, 9/7/1999, p.4c",5,M,Florida,"Behune Beach, Volusia County",N,other,other
28-Sep,Fall,2008,Unprovoked,usa,s. petersohn,40,M,Florida,Bethune Beach,N,surfing,other
25-Aug,,2023,Unprovoked,australia,"b. myatt, & m. michaelson, gsaf",44,M,New South Wales,"Lighthouse Beach, Port Macquarie ",Unknown,surfing,white shark
23-Aug,Summer,2023,Unprovoked,usa,"c. creswell, gsaf",9,Unknown,North Carolina,"Oak Island, Brunswick County",N,wading,other
22-Aug,Summer,2023,Watercraft,usa,"msn, 8/22/2023",19,M,California,"Pebble Beach, San Mateo County",N,fishing,other
21-Aug,,2023,Unconfirmed,bahamas,"the tribune, 8/21/2023",25,M,New Providence   Isoad,"Saunders Beach, Nassau",Unknown,other,other
16-Aug,,2023,Unprovoked,spain,las provincias,35,M,Valencia,Rabdells Beach,N,wading,other
16-Aug,,2023,Provoked,portugal,"portugese resident, 8/17/2023",Unknown,M,Norte, 9 nm off Vila do Conde ,N,fishing,other
12-Aug,,2023,Unprovoked,samoa,"samoa news,8/15/2023",Unknown,M,Unknown,Lano,Y,other,other
07-Aug,Summer,2023,Unprovoked,usa,".s. curatolo- wagemann, gsaff",65,F,New York,Rockaway,N,wading,other
31-Jul,Summer,2023,Unprovoked,usa,"fox35, 7/31/2023",22,M,Florida,"New Smyrna Beach, Volusia County",N,surfing,other
30-Jul,Summer,2023,Unprovoked,usa,"r. babington, gsaf",22,M,Florida,"Anna Maria Island, Manatee County",N,fishing,other
29-Jul,Summer,2023,Unprovoked,usa,"fox12, 8/1/2023",26,F,Florida,Tampa Bay,N,swimming,other
24-Jul,,2023,Unprovoked,australia,"b. myatt, gsaf",Unknown,M,Western Australia,Gnarabup Beach ,N,surfing,other
22-Jul,,2023,Unprovoked,australia,"b. myatt, gsaf",77,M,Western Australia,Yallingup Lagoon,N,snorkeling,other
21-Jul,Summer,2023,Unprovoked,usa,"c. creswell, gsaf",60,M,South Carolina,"Sea Pines Beach, Hilton Head Island, Beaufort County",N,other,other
18-Jul,,2023,Unprovoked,colombia,"la patria, 7/20/2023",38,M,Unknown,Nirvana,N,other,white shark
15-Jul,Summer,2023,Unprovoked,usa,"fox35, 7/15/2023",49,M,Florida,New Smyrna Beach,N,other,other
14-Jul,Summer,2023,Unprovoked,usa,"wesh2, 7/14/2023",21,M,Florida,New Smyrna Beach,N,surfing,other
Unknown,Unknown,2023,Watercraft,south africa,"ladbible, 7/14/2023",Unknown,Unknown,Eastern Cape Province,Chinta East ,N,other,other
04-Jul,,2023,Unprovoked,ecuador,"t. smith, gsaf",42,F,Unknown,Mosquera Islet,N,snorkeling,other
04-Jul,Summer,2023,Unprovoked,usa,"s.s. curatolo- wagemann, gsaff",Unknown,F,New York,"Cherry Grove, Suffolk County",N,other,other
04-Jul,Summer,2023,Unprovoked,usa,"s.s. curatolo- wagemann, gsaff",49,M,New York,"Fire Island Pines, Suffolk County",N,swimming,other
04-Jul,Summer,2023,Unprovoked,usa,"s.s. curatolo- wagemann, gsaff",47,M,New York,"Quogue Village Beach, Suffolk County",N,swimming,other
03-Jul,Summer,2023,Unprovoked,usa,"s.s. curatolo- wagemann, gsaff",15,M,New York,"Kismet Beach, Suffolk County",N,surfing,other
03-Jul,Summer,2023,Unprovoked,usa,"s.s. curatolo- wagemann, gsaff",15,F,New York,"Beach 3, Robert Moses State Park, Suffolk County",N,swimming,tiger shark
23-Jun,Summer,2023,Unprovoked,usa,"fox 35, 6/29/2023",Unknown,F,Florida,"Cocoa Beach, Brevard County",N,swimming,other
23-Jun,Summer,2023,Unprovoked,usa,"south florida sun sentinel, 6/23/2023",Unknown,M,Florida,"Flamingo Marina, Homestead, Miami-Dade County",N,fishing,other
Unknown,Unknown,2023,Unprovoked,usa,"bbc, 6/14/2023",Unknown,M,Hawaii,Laysan,N,other,tiger shark
08-Jun,,2023,Unprovoked,egypt,"m. michaelson, et al,gsa",24,M,Unknown,"Dream Beach, Hurguda",Y,swimming,tiger shark
