Date,Season,Year,Type,Country,Source,Age,Sex,State,Location,Fatal Y/N,Activity,Species
08-Jul,,1983,Unprovoked,bahamas,"miami herald, 7/13/1983, p.2d",13,M,Unknown,Green Turtle Cay,N,fishing,other
05-Jul,Summer,1983,Unprovoked,usa,"e.pace, fsaf",17,M,Florida,"Riviera Beach, Palm Beach County",N,other,other
29-Jun,Summer,1983,Unprovoked,usa,"miami herald, 6/30/1983,",42,M,Florida,"Off 12th Street, Miami Beach",N,swimming,other
22-Jun,,1983,Unprovoked,bahamas,"chicago tribune, 8/21/1983, p.b7",15,M,Unknown,"Off Sandy Point, Great Abaco Island",Y,fishing,other
20-Jun,Summer,1983,Unprovoked,usa,"miami herald, 6/22/1983, p.2b",21,M,Florida,"Cocoa Beach, Brevard County",N,surfing,other
15-Jun,,1983,Unprovoked,bahamas,"e.  pace, fsaf",30,M,Unknown,Carter Cay,N,other,other
15-Jun,,1983,Invalid,italy,medsaf,Unknown,M,Northwest Italy,Riomaggiore (Ligura),Unknown,other,other
Unknown,Unknown,1983,Unprovoked,bahamas,"e. pace, fsaf & m. levine, gsaf",Unknown,M,Unknown,Whale Cay,N,fishing,reef shark
31-May,Spring,1983,Unprovoked,usa,"e. pace; miami herald, 6/2/1983, p.10a",21,M,Florida,"Intracoastal Waterway, Boca Raton, Palm Beach County",N,other,other
24-May,Spring,1983,Unprovoked,usa,"e. pace, fsaf",15,M,Florida," Riviera Beach, Palm Beach County",N,surfing,other
21-May,Spring,1983,Unprovoked,usa,"the palm beach post, 3/15/1989;  miami herald, 5/22/1983 & 3/15/1989",22,M,Florida,"Haulover Inlet, Dade County",N,surfing,other
19-Apr,Spring,1983,Unprovoked,usa,"m. vorenberg, gsaf",Unknown,M,Florida,,Unknown,surfing,other
12-Apr,,1983,Unprovoked,south africa,"r. horn, east london aquarium; natal witness, 4/14/1983",27,M,Eastern Cape Province,Bonza Bay,N,fishing,other
02-Apr,Spring,1983,Unprovoked,usa,"miami herald, 4/3/1983, p.2d",16,M,Florida,"Lake Worth Beach, Palm Beach County",N,surfing,other
02-Apr,,1983,Invalid,south africa,"unverified report, nsb",Unknown,M,Kwazulu-Natal,Mpande,Unknown,other,other
30-Mar,,1983,Unprovoked,south africa,"w. johnson, m. levine, gsaf; g. charter, b. davis, g. cliff, nsb; t. wallett, pp.65-66",17,M,Kwazulu-Natal,Scottburgh,N,fishing,other
22-Mar,,1983,Unprovoked,south africa,"g. cliff, nsb",Unknown,M,Eastern Cape Province,Nahoon,N,surfing,other
10-Mar,Spring,1983,Unprovoked,usa,"m. vorenberg, gsaf",Unknown,M,Florida,"Juno Beach, Palm Beach County",N,surfing,other
Unknown,Unknown,1983,Unprovoked,new caledonia,w. leander,Unknown,Unknown,Unknown,"We, Lifou",N,other,other
20-Feb,,1983,Unprovoked,south africa,"g. charter, b. davis & g. cliff; natal mercury 2/22/1983",16,M,Kwazulu-Natal,Mtunzini,N,paddle,other
24-Jan,Winter,1983,Provoked,usa,"wilmington morningstar, 1/25/1983",43,M,South Carolina,60 miles southeast of Beaufort,N,fishing,other
15-Jan,,1983,Invalid,south africa,"g. cliff & b. davis, nsb",Unknown,M,Kwazulu-Natal,Amanzimtoti,Unknown,other,other
10-Jan,,1983,Unprovoked,south africa,"mrs. crewe, b. lipschitz, m. levine, gsaf",22,M,Western Cape Province,Muizenberg,N,surfing,other
08-Jan,,1983,Unprovoked,south africa,"p. debruyn, m. levine, gsaf",32,M,Western Cape Province,Holbaai,N,fishing,white shark
Unknown,Unknown,1983,Unprovoked,unknown,"times of india, 2/5/2012",Unknown,M,English Channel,,N,swimming,other
Unknown,Unknown,1983,Unprovoked,vanuatu,s. combs,Unknown,M,Malampa Province,"Off the beach opposite Atchin Island, Malakula",Y,other,other
Unknown,Unknown,1983,Provoked,usa,f. schwartz,Unknown,M,North & South Carolina,,N,fishing,other
26-Dec,,1982,Unprovoked,australia,"m. michaelson, gsaf & a. danvers",27,M,New South Wales,Suffolk Park,N,surfing,whaler shark
Unknown,Unknown,1982,Unprovoked,usa,f. schwartz,Unknown,M,South Carolina,"Isle of Palms, Charleston County",N,other,other
23-Oct,Fall,1982,Sea Disaster,usa,"new york times, 10/31/1982",Unknown,M,Unknown,,Unknown,other,other
12-Sep,Fall,2000,Unprovoked,usa,"sharksurvivor.com; florida today, 9/13/2000",26,F,Florida,"Sebastian Inlet, Indian River or Brevard County",N,surfing,other
30-Sep,,1982,Unprovoked,south africa,"r. horn, e.l. aquarium",16,M,Eastern Cape Province,"Nahoon, East London",N,surfing,other
30-Sep,,1982,Unprovoked,south africa,"m. levine, gsaf; r. horn, e.l. aquarium; t. wallett, p.46-47",16,M,Eastern Cape Province,"Nahoon, East London",N,surfing,white shark
06-Sep,Fall,1976,Unprovoked,usa,p. ferrer,15,M,Florida,"Sebastian, Indian River County",N,surfing,tiger shark
25-Sep,Fall,1982,Unprovoked,usa,r. collier,36,M,California,"Monastery Beach, Carmel Bay, Monterey County",N,diving,white shark
19-Sep,Fall,1982,Unprovoked,usa,"r.n. lea & d. miller; herder, p. 1-3; r. collier, pp.89-91; a. maccormick, pp.80-81",28,M,California,"Bear Harbor, Mendocino County",N,other,white shark
04-Sep,Fall,1982,Invalid,usa,"z. arocha, miami herald, 9/5/1982",25,M,Florida,"Hollywood Beach, Broward County",Unknown,other,other
29-Aug,,1982,Unprovoked,japan,k. nakaya,Unknown,M,Kumamoto Prefecture,Ariake Bay,Y,other,other
29-Aug,Summer,1982,Invalid,usa,"r.n. lea & d. miller; r. collier, pp.87-89",17,M,California,"Morro Rock, Morro Bay, San Obispo County",Unknown,surfing,other
29-Aug,,1982,Unprovoked,south africa,"v. keet, m. levine, gsaf",18,F,Western Cape Province,Langebaan,N,swimming,other
Unknown,Unknown,1982,Unprovoked,tunisia,medsaf,Unknown,M,Unknown,"Skanes, near Monaster",N,surfing,other
31-Jul,,1982,Invalid,south africa,"m. levine, gsaf",20,M,Kwazulu-Natal,Amanzimtoti,Unknown,other,other
24-Jul,,1982,Unprovoked,south africa,"b. plumb, m. levine, gsaf; r. horn, e.l. aquarium; t. wallett, p.46",38,M,Eastern Cape Province,"Nahoon, East London",N,paddle,white shark
24-Jul,Summer,1982,Unprovoked,usa,"r.n. lea & d. miller; r. collier, pp.86-87; g. ambrose, pp.113-120",26,M,California,"Point Buchon, San Luis Obispo County",N,paddle,white shark
19-Jul,Summer,1982,Unprovoked,usa,"miami herald, 7/21/1982, p.1d",17,M,Florida,"Stuart Beach, Martin County ",N,swimming,other
Unknown,Unknown,1982,Invalid,usa,"chronicle telegram, 7/12/1982, p.a4; daily herald , 7/13/1982",43,M,California,"Malibu, Los Angeles County",Unknown,swimming,other
01-Jul,Summer,1982,Unprovoked,usa,"daytona beach morning journal, 7/2/1982",19,F,Florida,"Daytona Beach, Volusia County",N,swimming,other
Unknown,Unknown,1982,Unprovoked,new caledonia,w. leander,Unknown,Unknown,South Province,"Sarcelle, Isle of Pines",N,other,other
29-Jun,,1982,Unprovoked,south africa,"m. levine, gsaf; r.b. wilson, b. davis, nsb; t. wallett, p.46",27,M,Eastern Cape Province,Ntlonyana Bay,Y,surfing,white shark
26-Jun,Summer,1982,Unprovoked,usa,"chillicothe constitution tribune, 6/30/1982",20,M,South Carolina,"Isle of Palms, Charleston County",N,swimming,other
26-Jun,,1982,Unprovoked,bahamas,"r. attrill; r.d. weeks, gsaf",19,M,Unknown,North Rat Cay Reef,N,fishing,other
Unknown,Unknown,1982,Unprovoked,usa,"wellsboro gazette, 6/30/1982",8,F,Florida,"Ormond Beach / Daytona Beach, Volusia County",N,other,other
13-Jun,Summer,1982,Unprovoked,usa,"j. borg, p.76; l. taylor (1993), pp.106-107; windsurfing magazine, sept/oct 1993",Unknown,M,Hawaii,"Ho'okipa Beach, Pa'ia, Maui",N,other,reef shark
Unknown,Unknown,1982,Invalid,usa,"clay creswell, gsaf",Unknown,F,South Carolina,"Daws Island, Broad River (near Beaufort)",Unknown,other,other
10-Mar,Spring,1982,Unprovoked,usa,"m. vorenberg, gsaf",16,M,Florida,"Palm Beach, Palm Beach County",N,surfing,other
07-Mar,,1982,Unprovoked,australia,"a. sharpe, pp.4, 86-87",20,M,New South Wales,"Tallow Beach, Byron Bay",Y,surfing,other
Unknown,Unknown,1982,Unprovoked,new caledonia,w. leander,Unknown,M,Unknown,,N,fishing,other
28-Feb,,1982,Unprovoked,australia,"c. black, pp. 159-163",32,M,Tasmania,South Cape Bay,Y,fishing,white shark
27-Feb,Winter,1982,Unprovoked,usa,"palm beach post, 3/2/1982",18,M,Florida,"Hobe Sound, Palm Beach County",N,surfing,other
17-Feb,,1982,Provoked,south africa,"mossel bay advertiser, 2/19/1982",Unknown,M,Western Cape Province,Mossel Bay,N,fishing,other
14-Feb,Winter,1982,Unprovoked,usa,"j. borg, p.75; l. taylor (1993), pp.104-105",Unknown,F,Hawaii,"White Plains Beach, Barbers Point, O'ahu",N,wading,other
14-Feb,Winter,1982,Unprovoked,usa,"j. borg, p.75; l. taylor (1993), pp.104-105",Unknown,F,Hawaii,"White Plains Beach, Barbers Point, O'ahu",N,swimming,other
13-Feb,Winter,1982,Unprovoked,usa,"m. vorenberg, gsaf",75,F,Florida,"Palm Beach, Palm Beach County",Y,swimming,other
07-Feb,Winter,1982,Unprovoked,usa,"r.n. lea & d. miller; r. collier, p.86",Unknown,M,California,"Stillwater Cove, Sonoma County",N,other,white shark
07-Feb,Winter,1982,Unprovoked,usa,"miami herald, 9/5/1982, p.1b",29,M,Florida,Elliot Key,Y,diving,other
29-Jan,,1982,Unprovoked,south africa,"j. phillips-page, m. levine, gsaf",20,M,Eastern Cape Province,Mpekeweni,N,swimming,other
Unknown,Unknown,1982,Watercraft,italy,"a. de maddalena; perfetti (1989), m. zuffa (pers. comm.)",Unknown,M,Unknown,"Lacona, Isola d'Elba",Unknown,boating,white shark
Unknown,Unknown,1982,Watercraft,italy,"a. de maddalena; perfetti (1989), m. zuffa (pers. comm.)",Unknown,M,Unknown,"Biodola, Isola d'Elba",N,fishing,white shark
Unknown,Unknown,1982,Unprovoked,tunisia,medsaf,Unknown,Unknown,Biserta,Bechateur,Unknown,fishing,other
19-Dec,Winter,1981,Unprovoked,usa,"r.n. lea & d. miller; r. collier, pp.84-85; a. maccormick, p.220",24,M,California,"South Moss Beach, Spanish Bay, Monterey Peninsula",Y,surfing,white shark
13-Dec,,1981,Unprovoked,australia,"r. mckenzie, sunday mail, 9/6/1987, p.11",Unknown,Unknown,Queensland,Green Island,N,other,other
13-Dec,Winter,1981,Unprovoked,usa,"j. borg, p.75; l. taylor (1993), pp.104-105",Unknown,M,Hawaii,"Nimitz Beach, Barbers Point, O'ahu",N,surfing,tiger shark
30-Nov,,1981,Unprovoked,reunion,g. van grevelynghe,Unknown,M,Saint-Philippe,Vicendo,N,fishing,other
19-Oct,,1981,Provoked,south africa,"m. levine, gsaf",Unknown,M,Western Cape Province,Mossel Bay,N,other,white shark
09-Nov,Fall,1981,Unprovoked,usa,"j. borg, p.75; l. taylor (1993), pp.104-105",59,M,Hawaii,"La'au Point, Moloka'i",N,boating,other
13-Sep,Fall,1988,Unprovoked,usa,"m. womack, news herald; orlando sentinel, 9/18/1988, p. b4",Unknown,F,Florida,"Shell Island Panama City Beach, Bay County",N,other,other
17-Oct,Fall,1981,Unprovoked,usa,"m. vorenberg, gsaf",Unknown,M,Florida,"Palm Beach, Palm Beach County",Unknown,surfing,other
14-Sep,Fall,2006,Unprovoked,usa,wftv.com,55,M,Florida,"Singer Island, Riviera Beach",N,swimming,other
10-Sep,Fall,1963,Provoked,usa,"h.d. baldridge, p.166; saf case #1284",16,M,Florida,"Snapper Point Jetty, Miami, Dade County",N,fishing,other
20-Sep,Fall,2020,Unprovoked,usa,"nine news, 8/30/2020",30,M,Florida,"Sombero Key Light, Monroe County",N,snorkeling,bull shark
11-Nov,Fall,1998,Unprovoked,usa,press report,13,M,Florida,"South Beach Park, Indian River County",N,other,other
15-Sep,Fall,1981,Unprovoked,usa,"s. pelham, m.d.; ny times, 9/21/1981, p.18, col.1; e. pace, fsaf",26,M,Florida,"Tampa Bay, Manatee County",Y,swimming,tiger shark
08-Sep,Fall,2012,Unprovoked,usa,"miami cbs local, 9/8/2012",Unknown,M,Florida,"South Beach, Miami-Dade County",N,swimming,other
14-Oct,Fall,2000,Unprovoked,usa,"d. robinson, vero beach press journal, 10/17/2000, p.a4",69,M,Florida,"South Beach, Sebastian, Indian River County",N,swimming,other
29-Aug,Summer,1981,Unprovoked,usa,"pacific stars and stripes, 8/31/1981",15,M,Florida,"New Smyrna Beach, Volusia County",N,surfing,other
24-Aug,Summer,1981,Provoked,usa,"a. maccormick, pp.82-83, citing the new orleans times-picayune, 8/25/1981",19,M,Florida,Gulf Island National Seashore Park,N,fishing,other
24-Aug,Summer,1981,Invalid,usa,"j. borg, p.75; l. taylor (1993), pp.104-105",Unknown,M,Hawaii,"Keaukaha, Hilo, Hawai'i",Unknown,fishing,other
10-Aug,Summer,1981,Unprovoked,usa,"e. pace, fsaf",Unknown,M,Florida,"Marathon, Monroe County",N,diving,other
10-Aug,Summer,1981,Unprovoked,usa,"e. pace, gsaf; j. mcaniff, saf; a. maccormick, pp.12 & 13; orlando sentinel, 12/6/1985; k duffy, daytona beach news journal, 8/26/2001",19,F,Florida,"Ormond Beach / Daytona Beach, Volusia County",Y,swimming,other
07-Aug,,1981,Unprovoked,bahamas,"r. marx, e. clark; m. levine, gsaf; note: marx says the incident took place in 8/8/1982 or 1983",53,M,Unknown,"Gingerbread Reef, east of Little Isaac Island ",N,surfing,mako shark
20-Jul,Summer,1981,Unprovoked,usa,"e. pace, gsaf",16,F,Florida,"St. Petersburg Beach, Pinellas County",N,swimming,other
18-Jul,,1981,Unprovoked,south africa,"b. v.d. helm; r. horn; m. levine, gsaf",32,M,Eastern Cape Province,Nahoon,N,surfing,other
07-Jul,Summer,1981,Unprovoked,usa,"e. pace, gsaf",Unknown,M,Florida,Carter Cay,N,fishing,other
01-Jul,,1981,Unprovoked,south africa,"chronicle telegram, 7/1/1981",Unknown,M,Kwazulu-Natal,Clansthal,N,other,other
Unknown,Unknown,1981,Watercraft,england,"the times (london), 6/15/1981",Unknown,M,Unknown,Isle of Wight,N,fishing,other
12-Jun,Summer,1981,Invalid,usa,"j. borg, p.74; l. taylor (1993), pp.104-105",Unknown,M,Hawaii,"Honoli'i Pali, Hilo Bay ('Alae Point), Hawai'i",Unknown,other,other
24-May,Spring,1981,Unprovoked,usa,"j. borg, p.87; l. taylor (1993), pp.104-105",Unknown,M,Hawaii,"Ha'ena Beach Park, Kaua'i",Y,fishing,other
23-May,,1981,Unprovoked,south korea,y. choi & k. nakaya,27,F,Chungnam,Wae-yeon Island,Y,other,white shark
20-May,,1981,Unprovoked,south africa,"m. jury, m. levine, gsaf",27,M,Eastern Cape Province,Nahoon,N,surfing,other
19-May,Spring,1981,Unprovoked,usa,j. mcaniff; miami herald 5/22/1981,32,M,Florida,"Sands Cut, Elliot Key",N,other,other
16-May,Spring,1981,Unprovoked,usa,"e. pace, fsaf",Unknown,M,Florida,"Jacksonville, Duval County",N,diving,other
10-May,,1981,Unprovoked,south africa,"m. smale, pe museum",19,M,Eastern Cape Province,King s Beach,N,surfing,other
07-May,,1981,Provoked,namibia,"m. levine, gsaf; natal witness",Unknown,M,Eronogo Region,Walvis Bay,N,other,other
08-Mar,,1981,Sea Disaster,bermuda,"new york times, 3/13/1981",Unknown,Unknown,Unknown,,N,other,other
05-May,,1981,Unprovoked,south africa,"s. hammerton, m. levine, gsaf; w. pople,  g. charter, nsb",24,M,Eastern Cape Province,Ntlonyane Bay,N,surfing,tiger shark
25-Mar,Spring,1981,Unprovoked,usa,"m. vorenberg, gsaf",19,M,Florida,"Singer Island, Riviera Beach, Palm Beach County",N,wading,bull shark
24-Mar,Spring,1981,Unprovoked,usa,"m. vorenberg, gsaf",24,M,Florida,"Singer Island, Riviera Beach, Palm Beach County",N,surfing,other
04-Mar,,1981,Unprovoked,chile,j. mccosker & a.c. engana,Unknown,M,Coquimbo,"Bahia Totoralillo, 80  km north of Coquimbo",N,fishing,white shark
Unknown,Unknown,1981,Unprovoked,brazil,"globo,",Unknown,Unknown,Rio De Janeiro,Cabo Frio,Unknown,diving,white shark
19-Feb,,1981,Unprovoked,south africa,"r. guy, m. levine, gsaf",30,M,Kwazulu-Natal,Umtentweni,N,swimming,other
16-Feb,,1981,Unprovoked,australia,"a. sharpe, p.134",Unknown,M,Western Australia,"Leighton Beach, north of Freemantle",N,other,hammerhead
07-Feb,,1981,Unprovoked,australia,"t. peake, gsaf",Unknown,Unknown,Western Australia,"Parker's Point, Rottnest Island",Unknown,other,other
02-Feb,Winter,1981,Unprovoked,usa,"m. vorenberg, gsaf",15,M,Florida,"Juno Beach, Palm Beach County",N,surfing,hammerhead
Unknown,Unknown,1981,Unprovoked,brazil,o. gadig,Unknown,Unknown,Rio De Janeiro,Cabo Frio,N,fishing,other
30-Jan,Winter,1981,Unprovoked,usa,j. mcaniff,25,M,Florida,20 miles from Mayport,N,fishing,tiger shark
01-Jan,,1981,Invalid,south africa,"w.o. hutt; w. pople, g. charter, b. davis, natal sharks board",23,M,Kwazulu-Natal,Widenham,Unknown,swimming,other
Unknown,Unknown,1981,Unprovoked,australia,"sunday mail (qld), 9/6/1987, p.10",27,M,New South Wales,Byron Bay,N,surfing,tiger shark
Unknown,Unknown,1981,Unprovoked,greece,m. bardanis,Unknown,M,Unknown,,N,fishing,other
Unknown,Unknown,1980,Unprovoked,south africa,"n. yates, m. levine, gsaf",25,M,Eastern Cape Province,Nahoon,N,paddle,other
26-Dec,,1980,Invalid,south africa,"eastern province herald, 12/29/1980",Unknown,Unknown,Eastern Cape Province,Port Elizabeth,Unknown,other,other
24-Nov,,1980,Unprovoked,reunion,g. van grevelynghe,22,M,Grand'Anse,Petite-Ile,N,fishing,white shark
18-Nov,,1980,Unprovoked,australia,"a. sharpe, pp.133-134",Unknown,M,Western Australia,Lancelin,N,swimming,other
17-Nov,,1980,Invalid,south africa,"w.o. hutt;  g. charter, b. davis, natal sharks board",Unknown,M,Kwazulu-Natal,Mnini,Unknown,swimming,other
11-Nov,,1980,Unprovoked,brazil,"jc online, 6/25/2012",16,M,Pernambuco,Piedade,Y,swimming,other
27-Oct,Fall,1980,Unprovoked,usa,"r.n.  lea & d. miller; r. collier, pp.83-84",29,M,Oregon,Off Umpqua River,N,surfing,white shark
17-Oct,Fall,1980,Unprovoked,usa,"r. n. lea & d. miller; r. collier, pp.82-83",19,M,California,"Moonstone Beach, Humboldt County",N,surfing,white shark
Unknown,Unknown,1980,Unprovoked,mexico,"valley independent, 8/22/1980, p.16",22,M,Unknown,,Y,other,other
Unknown,Unknown,1980,Unprovoked,usa,"b. gartleman, gsaf",Unknown,M,Louisiana,"Grand Isle, Jefferson Parish",N,wading,other
10-Aug,Summer,1980,Unprovoked,usa,"chronicle telegram, 8/11/1980; f. schwartz, p.23",10,F,North Carolina,"Ocean Isle, Brunswick County",N,wading,other
04-Aug,Summer,1980,Unprovoked,usa,"j. borg, p.75; l. taylor (1993), pp.104-105 - note: saf lists this as 8/10/1980",Unknown,M,Hawaii,"Puamana, Lahaina, Maui",N,other,tiger shark
26-Jul,,1980,Unprovoked,spain,c. moore. gsaf,Unknown,M,Unknown,"San Juan de la Rambla, Tenerife",N,other,other
27-Jul,Summer,1980,Unprovoked,usa,j. moffat; w. ruderman,15,M,New Jersey,"Ocean City, Cape May County",N,surfing,other
23-Jul,Summer,1980,Unprovoked,usa,"washington post, 7/23/1980",22,F,Delaware,Dewey Beach,N,other,other
Unknown,Unknown,1980,Unprovoked,usa,"c. creswell, gsaf, j. barnes",Unknown,M,North Carolina,"Emerald Isle Pier (near Morehead City), Carteret County",N,surfing,other
Unknown,Unknown,1980,Unprovoked,usa,"daytona beach morning journal, 7/9/1980",Unknown,M,Florida,"New Smyrna Beach, Volusia County",N,surfing,other
26-Jun,Summer,1980,Provoked,usa,"the australian women's weekly, 10/1/1980",44,F,California,"Off San Clemente Island, Los Angeles County",N,other,other
15-May,,1980,Unprovoked,south africa,"c. vernon, g. ross, p.e. museum; m. levine, gsaf",22,M,Eastern Cape Province,Fuller s Bay,N,surfing,other
25-Apr,,1980,Provoked,jamaica,"the gleaner, 7/27/1980",Unknown,M,St. Mary'S Parish,"Priestman's River area, East Portland",N,fishing,other
22-Apr,,1980,Sea Disaster,philippines,"daily collegian, 4/24/1980",Unknown,Unknown,Romblon Province,"Maestre de Campo Island, 120 miles south of Manila",Y,boating,other
Unknown,Unknown,1980,Unprovoked,mexico,k. giambalvo-sprague; r. collier,13,F,Sinaloa,Mazatl n,N,surfing,tiger shark
29-Mar,,1980,Unprovoked,south africa,"w. pople, g. charter, b. davis, natal sharks board",52,M,Kwazulu-Natal,Umdhloti,Y,other,tiger shark
28-Mar,,1980,Unprovoked,brazil,m. szpilman,Unknown,M,Rio De Janeiro,"Copacabana Beach, Rio de Janiero",N,swimming,other
15-Mar,,1980,Sea Disaster,philippines,"valley independent, 3/17/1980",Unknown,F,Unknown,250 miles southwest of Manila,Y,boating,other
11-Mar,,1980,Provoked,south africa,"f.m. binneman, p. logan, m. levine, gsaf",61,M,Western Cape Province,Velddrif,N,fishing,hammerhead
31-Jan,,1980,Unprovoked,south africa,"m. levine, gsaf; w. pople, g. charter, b. davis, nsb; t. wallett, p.60",24,M,Kwazulu-Natal,Ballito,N,other,white shark
25-Jan,,1980,Unprovoked,kenya,j. e. randall,29,M,Lamu Archipelago,South of Lamu Island,N,fishing,other
15-Jan,,1980,Provoked,south africa,"l. winkworth, m. levine, gsaf",29,M,Kwazulu-Natal,Anstey s,N,fishing,other
13-Jan,,1980,Unprovoked,south africa,"eastern province herald, 1/17/1980, m. levine, gsaf",Unknown,M,Eastern Cape Province,Sardinia Bay,N,swimming,hammerhead
10-Jan,,1980,Unprovoked,south africa,m. smale,25,M,Eastern Cape Province,King s Beach,N,swimming,other
05-Jan,,1980,Unprovoked,chile,j. mccosker &  a.c. engana,Unknown,M,Los Vilos,"Punta Negra, Pichidangui",Y,other,white shark
Unknown,Unknown,1980,Provoked,unknown,"a. resciniti, pp.105-106",34,M,Unknown,Onboard swordfish trawler,N,other,other
Unknown,Unknown,1980,Invalid,greece,medsaf,Unknown,M,Unknown,,Unknown,surfing,white shark
Unknown,Unknown,1980,Invalid,south africa,"p. sachs, m. levine, gsaf",20,M,Eastern Cape Province,Bonza Bay,Unknown,fishing,other
Unknown,Unknown,1980,Unprovoked,tonga,dr. s. fonea,Unknown,M,Ha'Api,Ha'ano Island,N,fishing,other
21-Dec,,1979,Unprovoked,south africa,"m. bowker; w. pople, nsb",18,M,Eastern Cape Province,Kenton-on-Sea,N,swimming,other
05-Dec,,1979,Invalid,portugal,c. moore. gsaf,19,M,Unknown,"Sao Jorge, Madeira Island",Y,fishing,white shark
Unknown,Unknown,1979,Unprovoked,unknown,"sydney morning herald, 12/6/1979",32,M,Unknown,,N,diving,other
27-Nov,Fall,1979,Unprovoked,usa,"d. miller & r. collier; r. collier, p. 76-79; j. mccosker & r.n. lea; k. doudt",20,M,Oregon,"Haystack Rock, Cannon Beach, Clatsop County",N,surfing,white shark
12-Nov,,1979,Provoked,south africa,gsaf,Unknown,Unknown,Western Cape Province,Macassar,N,fishing,white shark
22-Oct,,1979,Provoked,south africa,gsaf,Unknown,M,Eastern Cape Province,Algoa Bay,N,fishing,other
14-Sep,,1979,Unprovoked,australia,"canberra times, 9/15/1979",18,M,New South Wales,Byron Bay,N,other,other
28-Aug,,1979,Unprovoked,hong kong,"sydney morning herald, 8/30/1979",21,M,Unknown,Mirs Bay,Y,swimming,other
26-Aug,,1979,Unprovoked,hong kong,"j. wong, gsaf",16,M,Ho Ha Wan Marine Park,,Y,other,other
05-Aug,Summer,1979,Unprovoked,usa,"sarasota herald tribune, 8/9/1979",49,M,Florida,"Daytona Beach, Volusia County",N,kayaking,other
03-Aug,,1979,Unprovoked,thailand,"the canberra times, 8/3/1979",Unknown,M,Southern Thailand,,Y,other,other
19-Jun,Summer,1979,Sea Disaster,usa,"troy record, 6/21/1979",56,M,Florida,10 miles off Cape Canaveral,N,boating,other
27-May,Spring,1979,Invalid,usa,"post standard, 5/29/1979, p.3",36,M,Florida,"Fort Walton Beach, Okaloosa County",Unknown,other,other
05-May,,1979,Provoked,south africa,dr. p. landsberg,25,M,Western Cape Province,"Hangklip, False Bay",N,fishing,white shark
03-May,,1979,Unprovoked,south africa,"w. pople, g. charter, b. davis, nsb",Unknown,M,Kwazulu-Natal,Mbibi,Y,other,other
Unknown,Unknown,1979,Unprovoked,new caledonia,"w. leander; les nouvelles caledoniennes, 3/17/2000",Unknown,Unknown,North Province,Ile Yand  (between Poum and B lep),N,fishing,other
Unknown,Unknown,1979,Unprovoked,new caledonia,w. leander,Unknown,M,North Province,Balade,Y,other,other
08-Apr,Spring,1979,Unprovoked,usa,"m. vorenberg, gsaf",24,M,Florida,"Public Beach (Carlin Park), Jupiter, Palm Beach County",N,swimming,other
08-Apr,Spring,1979,Unprovoked,usa,"m. vorenberg, gsaf",8,M,Florida,"Municipal Beach, Boyton Beach, Palm Beach County",N,surfing,other
24-Mar,Spring,1979,Unprovoked,usa,"m. vorenberg, gsaf",27,M,Florida,"Singer Island, Riviera Beach, Palm Beach County",N,surfing,other
11-Mar,Spring,1979,Unprovoked,usa,"d. miller & r. collier, r. collier, p.76",Unknown,M,California,"Ano Nuevo Island, San Mateo, County",N,other,white shark
01-Mar,,1979,Watercraft,south africa,gsaf,Unknown,Unknown,Western Cape Province,Seal Island,N,other,other
Unknown,Unknown,1979,Unprovoked,new caledonia,w. leander,Unknown,M,Grand Terre,"Five Mile Beach, I'le Ouen",Y,fishing,other
21-Feb,,1979,Unprovoked,south africa,"c. kantor,  dr. macrae, m. levine, gsaf; g. charter, nsb",19,M,Eastern Cape Province,Port Alfred,N,surfing,other
Unknown,Unknown,1979,Unprovoked,usa,"j. borg, p.74; l. taylor (1993), pp.104-105",Unknown,M,Hawaii,"South Kohala, Hawai'i",Y,fishing,other
29-Dec,,1978,Unprovoked,australia,"r. mckenzie, sunday mail, 9/6/1987, p.11",Unknown,M,Queensland,Bribie Island,N,other,other
12-Dec,,1978,Unprovoked,south africa,"m. levine, gsaf; w. pople, g. charter, nsb; dr. marais; t. wallett, pp.57-58",23,M,Kwazulu-Natal,Sodwana,Y,fishing,white shark
26-Nov,Fall,1978,Unprovoked,usa,"star-phoenix, 11/29/1978",Unknown,M,Hawaii,"Ewa, O'ahu",N,surfing,other
12-Nov,Fall,2003,Unprovoked,usa,"s. petersohn, gsaf",24,M,Florida,"South Jetty, New Smyrna Beach, Volusia County",N,surfing,other
21-Oct,,1978,Invalid,south africa,"natal parks board, j. daniel; w. pople, g. charter, gsaf",Unknown,M,Kwazulu-Natal,"Fishing camp, St. Lucia Estuary",Unknown,fishing,other
27-Sep,,1978,Unprovoked,south africa,"e. lombard, m. levine, gsaf",27,M,Western Cape Province,"Miller's Point, False Bay",N,fishing,white shark
16-Sep,,1978,Unprovoked,italy,a. de maddalena; marini (1989),Unknown,M,Unknown,Capo d'Anzio,N,diving,white shark
03-Sep,Fall,1978,Unprovoked,usa,"a. currie, gsaf",28,M,California,Santa Barbara,N,other,other
Unknown,Unknown,1978,Unprovoked,australia,"chronicle telegram, 9/2/1978",34,M,Tasmania,"Cape Pillar, Storm Bay",N,other,other
05-Aug,Summer,1978,Unprovoked,usa,"d. miller & r. collier, r. collier, p.75",Unknown,M,California,"Pajaro Dunes, Santa Cruz County",N,wading,other
Unknown,Unknown,1978,Unprovoked,usa,"miami news, 8/1/1978",27,M,Florida,Florida Straits,N,other,other
27-Jul,Summer,1978,Sea Disaster,usa,"ny times, 7/28/1978, p.6, col.6",39,M,South Carolina,,N,boating,other
19-Jul,Summer,1978,Provoked,usa,"fresno bee, 7/19/1978",27,M,California,"Newport Beach, Orange County",N,fishing,other
21-Jun,Summer,1978,Unprovoked,usa,"bryan times, 6/23/1978",20,M,Florida,"South of Neptune Beach, Duval County",N,surfing,other
21-Jun,Summer,1978,Unprovoked,usa,"bryan times, 6/23/1978",17,M,Florida,"Neptune Beach, Duval County",N,surfing,other
07-Jun,,1978,Invalid,italy,a. demaddalena,Unknown,Unknown,Golfo De Venezia,Acqua alta research platform,Unknown,other,other
02-Apr,,1978,Unprovoked,marshall islands,"modesto bee, 4/4/1978",25,M,Ralik Archipelago,Enewetak Atoll,N,diving,other
02-Apr,,1978,Unprovoked,marshall islands,"modesto bee, 4/4/1978",23,M,Ralik Archipelago,Enewetak Atoll,N,diving,other
Unknown,Unknown,1978,Unprovoked,australia,"c. black, pp. 157-159",Unknown,M,Tasmania,Beechford,N,other,other
05-Mar,,1978,Watercraft,south africa,gsaf,Unknown,Unknown,Eastern Cape Province,"Gulu Deep, East London",N,other,other
